"city","province","prefecture","country","travel_advisor","travel_restriction_date_start1","travel_restriction_date_end1","strict_restrictions_prefecture","travel_restriction_date_start2","travel_restriction_date_end2","notes","tr_source","Accessed_date","who_by","tr_source2","accessed_date2","who_by2","notes2"
NA,"all Chinese provinces",NA,"China","Chinese Ministry of Tourism",2020-01-23,NA,NA,NA,NA,"notification of prevention and control procedures","https://www.mct.gov.cn/whzx/ggtz/202001/t20200123_850561.htm",2020-02-08,"ARW",NA,NA,NA,NA
NA,"all Chinese provinces",NA,"China","Chinese Ministry of Tourism",2020-01-14,NA,NA,NA,NA,"unclear","http://zwgk.mct.gov.cn/auto255/202001/t20200116_850384.html?keywords=",2020-02-08,"ARW",NA,NA,NA,NA
NA,"Anhui Province","Hefei","China",NA,2020-02-05,2020-02-26,"yes",NA,NA,"closed management; A total of 16 provincial-level regions in China — Gansu, Liaoning, Guizhou, Yunnan, Guangxi, Guangdong, Fujian, Shanxi, Jiangxi, Sichuan, Anhui, Hainan, Qinghai, Inner Mongolia, Xinjiang and Jilin have lowered their emergency response levels to the novel coronavirus as of Feb 26.","https://www.ettoday.net/news/20200210/1642382.htm",2020-02-10,"ARW","http://en.nhc.gov.cn/2020-02/27/c_77012.htm","2020-05-22","TCO",NA
NA,"Beijing Municipality","Beijing Municipality","China",NA,2020-01-25,2020-02-08,NA,NA,NA,"interprovincial road passenger transport","http://www.chinadaily.com.cn/a/202001/25/WS5e2c30fea310128217273397.html",2020-02-08,"ARW",NA,NA,NA,NA
NA,"Beijing Municipality","Beijing Municipality","China",NA,2020-01-24,NA,NA,NA,NA,"Temperature of metro passengers at 55 stations","http://www.gov.cn/xinwen/2020-01/28/content_5472657.htm",2020-02-08,"ARW",NA,NA,NA,NA
NA,"Beijing Municipality","Beijing Municipality","China",NA,2020-01-26,NA,NA,NA,NA,"Non-coordinated thermal imaging in effect","http://www.gov.cn/xinwen/2020-01/28/content_5472657.htm",2020-02-08,"ARW",NA,NA,NA,NA
NA,"Beijing Municipality","Beijing Municipality","China",NA,2020-01-27,NA,NA,NA,NA,"suspend all group tour products","http://companies.caixin.com/2020-01-26/101508589.html",2020-02-08,"ARW",NA,NA,NA,NA
NA,"Beijing Municipality","Beijing Municipality","China",NA,2020-01-27,NA,NA,NA,NA,"Temperature of metro passengers at all 72 stations of Beijing-Hong Kong Line 4 + Daxing, 14, 16 implemented","http://www.gov.cn/xinwen/2020-01/28/content_5472657.htm",2020-02-08,"ARW",NA,NA,NA,NA
"Wanzhou District","Chongqing Municipality","Chongqing Municipality","China",NA,2020-01-31,2020-02-29,"yes",NA,NA,"By the end of February, nearly 2 million workers had left Chongqing to work in other places.","https://www.ettoday.net/news/20200210/1642382.htm",2020-02-10,"ARW","http://en.nhc.gov.cn/2020-03/06/c_77397.htm","2020-05-22","TCO",NA
"Liangping District","Chongqing Municipality","Chongqing Municipality","China",NA,2020-01-31,2020-02-29,"yes",NA,NA,"By the end of February, nearly 2 million workers had left Chongqing to work in other places.","https://www.ettoday.net/news/20200210/1642382.htm",2020-02-10,"ARW","http://en.nhc.gov.cn/2020-03/06/c_77397.htm","2020-05-22","TCO",NA
"Fuzhou City","Fuijian Province","Fuzhou","China",NA,2020-02-04,2020-02-26,"yes",NA,NA,"A total of 16 provincial-level regions in China — Gansu, Liaoning, Guizhou, Yunnan, Guangxi, Guangdong, Fujian, Shanxi, Jiangxi, Sichuan, Anhui, Hainan, Qinghai, Inner Mongolia, Xinjiang and Jilin have lowered their emergency response levels to the novel coronavirus as of Feb 26.","https://www.ettoday.net/news/20200210/1642382.htm",2020-02-10,"ARW","http://en.nhc.gov.cn/2020-02/27/c_77012.htm","2020-05-22","TCO",NA
NA,"Gansu province","Lanzhou","China",NA,2020-02-08,2020-03-04,"yes",NA,NA,"As of 19:00, 4 March, nine provinces, namely, Gansu, Liaoning, Guizhou, Yunnan, Guangxi, Inner Mongolia, Qinghai, Hainan and Shaanxi, revised their response from level 1 down to level 3.","https://www.ettoday.net/news/20200210/1642382.htm",2020-02-10,"ARW","http://en.nhc.gov.cn/2020-03/05/c_77319.htm","2020-05-21","TCO",NA
NA,"Gansu province","Lanzhou","China",NA,2020-01-27,2020-02-08,NA,NA,NA,"suspend 30 national railways","http://www.gansu.gov.cn/art/2020/1/27/art_36_443084.html",2020-03-30,"JW",NA,NA,NA,NA
NA,"Gansu province","Lanzhou","China",NA,2020-01-26,2020-03-04,"yes",NA,NA,"stop interprovincial shuttle buses and tourist cars; As of 19:00, 4 March, nine provinces, namely, Gansu, Liaoning, Guizhou, Yunnan, Guangxi, Inner Mongolia, Qinghai, Hainan and Shaanxi, revised their response from level 1 down to level 3.","http://www.gansu.gov.cn/art/2020/1/30/art_36_443243.html",2020-03-30,"JW","http://en.nhc.gov.cn/2020-03/05/c_77319.htm","2020-05-21","TCO",NA
NA,"Gansu province","Lanzhou","China",NA,2020-02-04,2020-03-01,NA,NA,NA,"suspend 71 national railways","http://www.gansu.gov.cn/art/2020/2/4/art_36_443625.html",2020-03-30,"JW",NA,NA,NA,NA
NA,"Gansu province",NA,"China",NA,2020-01-23,NA,NA,NA,NA,"Temperature of all railways, airports, and other transportation stations","http://www.gansu.gov.cn/art/2020/1/23/art_36_442808.html",2020-03-30,"JW",NA,NA,NA,NA
NA,"Guangdong Province","Guangzhou","China",NA,2020-02-07,2020-03-04,"yes",NA,NA,"As of 19:00, 4 March, eight provinces, namely, Shanxi, Guangdong, Jiangsu, Xinjiang, Sichuan, Ningxia, Zhejiang and Heilongjiang, lowered their emergency response to COVID-19 from level 1 to level 2","https://www.ettoday.net/news/20200210/1642382.htm",2020-02-10,"ARW","http://en.nhc.gov.cn/2020-03/05/c_77319.htm","2020-05-21","TCO",NA
NA,"Guangdong Province","Shenzhen","China",NA,2020-02-07,2020-03-04,"yes",NA,NA,"As of 19:00, 4 March, eight provinces, namely, Shanxi, Guangdong, Jiangsu, Xinjiang, Sichuan, Ningxia, Zhejiang and Heilongjiang, lowered their emergency response to COVID-19 from level 1 to level 2","https://www.ettoday.net/news/20200210/1642382.htm",2020-02-10,"ARW","http://en.nhc.gov.cn/2020-03/05/c_77319.htm","2020-05-21","TCO",NA
NA,"Guangxi Zhuang Autonomous Region","NanNing","China",NA,2020-02-05,2020-03-04,"yes",NA,NA,"closed management; nine provinces, namely, Gansu, Liaoning, Guizhou, Yunnan, Guangxi, Inner Mongolia, Qinghai, Hainan and Shaanxi, revised their response from level 1 down to level 3.","https://www.ettoday.net/news/20200210/1642382.htm",2020-02-10,"ARW","http://en.nhc.gov.cn/2020-03/05/c_77319.htm","2020-05-21","TCO",NA
"Sanya","Hainan Province","Sanya","China",NA,2020-01-25,NA,NA,NA,NA,"interprovincial road passenger transport","http://companies.caixin.com/2020-01-26/101508589.html",2020-02-08,"ARW",NA,NA,NA,NA
NA,"Hebei Province","Shijiazhuang","China",NA,2020-02-06,2020-04-30,"yes",NA,NA,"closed management; Hebei province and Tianjin municipality will also lower their emergency response to COVID-19 from the top level to the second level starting on Thursday morning, according to their governments, which means that by then, only Hubei province will still maintain the Grade 1 response.","https://www.ettoday.net/news/20200210/1642382.htm",2020-02-10,"ARW","http://en.nhc.gov.cn/2020-04/30/c_79789.htm","2020-05-22","TCO",NA
"Harbin City","Heilongjiang Province","Harbin","China",NA,2020-02-04,2020-03-04,"yes",NA,NA,"As of 19:00, 4 March, eight provinces, namely, Shanxi, Guangdong, Jiangsu, Xinjiang, Sichuan, Ningxia, Zhejiang and Heilongjiang, lowered their emergency response to COVID-19 from level 1 to level 2","https://www.ettoday.net/news/20200210/1642382.htm",2020-02-10,"ARW","http://en.nhc.gov.cn/2020-03/05/c_77319.htm","2020-05-21","TCO",NA
NA,"Heilongjiang Province",NA,"China",NA,2020-01-27,2020-03-04,"yes",NA,NA,"suspend interprovincial charter buses; As of 19:00, 4 March, eight provinces, namely, Shanxi, Guangdong, Jiangsu, Xinjiang, Sichuan, Ningxia, Zhejiang and Heilongjiang, lowered their emergency response to COVID-19 from level 1 to level 2","http://www.hlj.gov.cn/zwfb/system/2020/01/29/010918719.shtml",2020-03-30,"JW","http://en.nhc.gov.cn/2020-03/05/c_77319.htm","2020-05-21","TCO",NA
NA,"Heilongjiang Province",NA,"China",NA,2020-02-01,2020-02-24,NA,NA,NA,"close toll booths on expressways","http://www.hlj.gov.cn/zwfb/system/2020/02/01/010918786.shtml",2020-03-30,"JW",NA,NA,NA,NA
NA,"Heilongjiang Province",NA,"China",NA,2020-01-29,NA,NA,NA,NA,"security checkpoints on epressways","http://www.hlj.gov.cn/zwfb/system/2020/01/29/010918719.shtml",2020-03-30,"JW",NA,NA,NA,NA
"Zhengzhou City","Henan Province","Zhengzhou","China",NA,2020-02-04,2020-03-05,"yes",NA,NA,"Foxconn is gradually resuming production capacity at its major manufacturing base in Zhengzhou, Central China's Henan province.","https://www.ettoday.net/news/20200210/1642382.htm",2020-02-10,"ARW","http://en.nhc.gov.cn/2020-03/05/c_77343.htm","2020-05-22","TCO",NA
"Zhumadian City","Henan Province","Zhumadian","China",NA,2020-02-04,2020-02-22,"yes",NA,NA,"People board a customized train heading for East China's Zhejiang province at Zhoukou East Railway Station in Zhoukou, Central China's Henan province, Feb 22, 2020. More than 700 passengers from Central China's Henan province took the customized train to East China's Zhejiang province to resume work.","https://www.ettoday.net/news/20200210/1642382.htm",2020-02-10,"ARW","https://www.chinadaily.com.cn/a/202002/24/WS5e53658fa310128217279d0c.html","2020-05-22","TCO",NA
"Jia County","Henan Province","Pingdingshan","China",NA,2020-04-01,2020-02-22,"yes",NA,NA,"On Wednesday, April 1, authorities in Henan province placed Jia county on an indefinite lockdown to prevent further spread of coronavirus disease (COVID-19). Per the directive, individuals will be barred from traveling outside the county. Additionally, movement within the county will be severely restricted, and residents must have special permits to leave their homes.","https://www.garda.com/crisis24/news-alerts/328356/china-authorities-lock-down-jia-county-henan-province-due-to-covid-19-april-1-update-50",2020-05-08,"TCO","https://www.chinadaily.com.cn/a/202002/24/WS5e53658fa310128217279d0c.html","2020-05-22","TCO",NA
NA,"Hong Kong Special Administrative Region","Hong Kong Special Administrative Region","China",NA,2020-01-30,NA,"yes",NA,NA,"cross-border travel restricted. Passengers who have been in China (People's Rep.) in the past 14 days are not allowed to enter if their permitted stay in Hong Kong (SAR China) is less than 14 days. This does not apply to passengers with a Hong Kong (SAR China) passport. Passengers arriving from or having been in China (People's Rep.) or Korea (Rep.) in the past 14 days are subject to compulsory quarantine for 14 days.","https://www.bbc.com/news/world-asia-china-51279726",2020-02-08,"ARW",NA,NA,NA,NA
NA,"Hong Kong Special Administrative Region","Hong Kong Special Administrative Region","China",NA,2020-01-24,NA,NA,NA,NA,"Temperature of metro passengers at 55 stations","http://www.gov.cn/xinwen/2020-01/28/content_5472657.htm",2020-02-08,"ARW",NA,NA,NA,NA
NA,"Hong Kong Special Administrative Region","Hong Kong Special Administrative Region","China",NA,2020-01-26,NA,NA,NA,NA,"Non-coordinated thermal imaging in effect","http://www.gov.cn/xinwen/2020-01/28/content_5472657.htm",2020-02-08,"ARW",NA,NA,NA,NA
NA,"Hong Kong Special Administrative Region","Hong Kong Special Administrative Region","China",NA,2020-01-27,NA,NA,NA,NA,"Temperature of metro passengers at all 72 stations of Beijing-Hong Kong Line 4 + Daxing, 14, 16 implemented","http://www.gov.cn/xinwen/2020-01/28/content_5472657.htm",2020-02-08,"ARW",NA,NA,NA,NA
NA,"Hong Kong Special Administrative Region","Hong Kong Special Administrative Region","China",NA,2020-01-30,NA,NA,NA,NA,"six of 14 immigration checkpoints closed","https://www.chinadaily.com.cn/a/202001/28/WS5e302a93a3101282172737e0.html",2020-02-08,"ARW",NA,NA,NA,NA
NA,"Hong Kong Special Administrative Region","Hong Kong Special Administrative Region","China",NA,2020-01-27,NA,"yes",NA,NA,"Restrict Hubei residents and people who have visited Hubei Province in the past 14 days from entering Hong Kong","https://www.info.gov.hk/gia/general/202001/26/P2020012600751.htm",2020-03-30,"JW",NA,NA,NA,NA
NA,"Hong Kong Special Administrative Region","Hong Kong Special Administrative Region","China",NA,2020-01-30,NA,NA,NA,NA,"Guangzhou-Shenzhen-Hong Kong Express Rail Line and Intercity Through Train rail line suspended; reduce cross boundary and shuttle buses; four local airlines reduce flights; cross-boundary ferry suspended","https://www.info.gov.hk/gia/general/202001/28/P2020012800727.htm",2020-03-30,"JW",NA,NA,NA,NA
"Enshi City","Hubei Province","Enshi Tujia and Miao Autonomous Prefecture","China",NA,2020-01-24,2020-03-25,"yes",NA,NA,"Indoor entertainment centers closed","https://www.channelnewsasia.com/news/asia/wuhan-virus-china-pneumonia-outbreak-city-shut-12320076",2020-02-08,"ARW","https://en.wikipedia.org/wiki/2020_Hubei_lockdowns#cite_note-gua-36","2020-04-15","TCO",NA
"Ezhou City","Hubei Province","Ezhou","China",NA,2020-01-23,2020-03-25,"yes",NA,NA,"closed in evening of January 23rd; 25 March Hubei lifts the lockdown outside of Wuhan, although people will still need to confirm their ""Green Code"" health classification, designated by Alipay's monitoring system,[ to travel.","https://www.straitstimes.com/asia/east-asia/china-locks-down-two-more-cities-huanggang-and-ezhou-after-wuhan",2020-02-08,"ARW","https://www.theguardian.com/world/2020/mar/24/china-to-lift-travel-restrictions-in-hubei-after-months-of-coronavirus-lockdown","2020-04-15","TCO",NA
"Huanggang city","Hubei Province","Huanggang","China",NA,2020-01-23,2020-03-25,"yes",NA,NA,"closed in evening of January 23rd; 25 March Hubei lifts the lockdown outside of Wuhan, although people will still need to confirm their ""Green Code"" health classification, designated by Alipay's monitoring system,[ to travel.","https://www.straitstimes.com/asia/east-asia/china-locks-down-two-more-cities-huanggang-and-ezhou-after-wuhan",2020-02-08,"ARW","https://www.theguardian.com/world/2020/mar/24/china-to-lift-travel-restrictions-in-hubei-after-months-of-coronavirus-lockdown","2020-04-15","TCO",NA
"Jingmen City","Hubei Province","Jingmen","China",NA,2020-01-24,2020-03-25,"yes",NA,NA,NA,"https://www.ettoday.net/news/20200210/1642382.htm",2020-02-10,"ARW","https://www.theguardian.com/world/2020/mar/24/china-to-lift-travel-restrictions-in-hubei-after-months-of-coronavirus-lockdown","2020-04-14","TCO",NA
"Qianjiang City","Hubei Province","Qianjiang","China",NA,2020-01-23,2020-03-25,"yes",NA,NA,"travel restrictions","https://www.ettoday.net/news/20200210/1642382.html ; https://www.cnn.com/asia/live-news/coronavirus-outbreak-hnk-intl-01-24-20/index.html",2020-02-08,"ARW","https://www.theguardian.com/world/2020/mar/24/china-to-lift-travel-restrictions-in-hubei-after-months-of-coronavirus-lockdown","2020-04-15","TCO",NA
"Suizhou City","Hubei Province","Suizhou","China",NA,2020-01-25,2020-03-25,"yes",NA,NA,"travel restrictions; alternative source lists 1/25/20","https://www.cnn.com/asia/live-news/coronavirus-outbreak-hnk-intl-01-24-20/index.html",2020-02-08,"ARW","https://www.theguardian.com/world/2020/mar/24/china-to-lift-travel-restrictions-in-hubei-after-months-of-coronavirus-lockdown","2020-04-15","TCO",NA
"Tianmen City","Hubei Province","Tianmen","China",NA,2020-01-23,2020-03-25,"yes",NA,NA,"closed in evening of January 23rd; 25 March Hubei lifts the lockdown outside of Wuhan, although people will still need to confirm their ""Green Code"" health classification, designated by Alipay's monitoring system,[ to travel.","https://www.ettoday.net/news/20200210/1642382.htm",2020-02-10,"ARW","https://www.theguardian.com/world/2020/mar/24/china-to-lift-travel-restrictions-in-hubei-after-months-of-coronavirus-lockdown","2020-04-15","TCO",NA
"Wuhan City","Hubei Province","Wuhan","China",NA,2020-01-23,2020-04-08,"yes",NA,NA,"placed under effective quarantine as air and rail departures were suspended.","https://www.straitstimes.com/asia/east-asia/china-locks-down-two-more-cities-huanggang-and-ezhou-after-wuhan",2020-02-08,"ARW","https://www.bloomberg.com/news/articles/2020-03-24/china-to-lift-lockdown-over-virus-epicenter-wuhan-on-april-8","2020-04-08","TCO",NA
"Chibi City","Hubei Province","Xianning","China",NA,2020-01-23,2020-03-25,"yes",NA,NA,"quarantine","https://www.straitstimes.com/asia/east-asia/china-locks-down-two-more-cities-huanggang-and-ezhou-after-wuhan",2020-02-08,"ARW","https://www.theguardian.com/world/2020/mar/24/china-to-lift-travel-restrictions-in-hubei-after-months-of-coronavirus-lockdown","2020-04-15","TCO",NA
"Shiyan City","Hubei Province","Shiyan","China",NA,2020-01-24,2020-03-25,"yes",NA,NA,NA,"https://www.ettoday.net/news/20200210/1642382.htm",2020-04-15,"TCO","https://www.theguardian.com/world/2020/mar/24/china-to-lift-travel-restrictions-in-hubei-after-months-of-coronavirus-lockdown","2020-04-15","TCO",NA
"Xianning City","Hubei Province","Xianning","China",NA,2020-01-24,2020-03-25,"yes",NA,NA,"travel restrictions; buses suspended","https://www.cnn.com/asia/live-news/coronavirus-outbreak-hnk-intl-01-24-20/index.html",2020-02-08,"ARW","https://www.theguardian.com/world/2020/mar/24/china-to-lift-travel-restrictions-in-hubei-after-months-of-coronavirus-lockdown","2020-04-15","TCO",NA
"Xiantao","Hubei Province","Xiantao","China",NA,2020-01-23,2020-03-25,"yes",NA,NA,"quarantine","https://www.channelnewsasia.com/news/asia/wuhan-virus-china-pneumonia-outbreak-city-shut-12320076 ; https://www.ettoday.net/news/20200210/1642382.html",2020-02-08,"ARW","https://www.theguardian.com/world/2020/mar/24/china-to-lift-travel-restrictions-in-hubei-after-months-of-coronavirus-lockdown","2020-04-15","TCO",NA
"Zhijang","Hubei Province","Yichang","China",NA,2020-01-24,2020-03-25,"yes",NA,NA,"travel restrictions; public spaces closed","https://www.cnn.com/asia/live-news/coronavirus-outbreak-hnk-intl-01-24-20/index.html",2020-02-08,"ARW","https://www.theguardian.com/world/2020/mar/24/china-to-lift-travel-restrictions-in-hubei-after-months-of-coronavirus-lockdown","2020-04-15","TCO",NA
"Yichang City","Hubei Province","Yichang","China",NA,2020-01-24,2020-03-25,"yes",NA,NA,NA,"https://www.ettoday.net/news/20200210/1642382.htm",2020-02-10,"ARW","https://www.theguardian.com/world/2020/mar/24/china-to-lift-travel-restrictions-in-hubei-after-months-of-coronavirus-lockdown","2020-04-15","TCO",NA
"Dangyang City","Hubei Province","Yichang","China",NA,2020-01-24,2020-03-25,"yes",NA,NA,NA,"https://www.ettoday.net/news/20200210/1642382.htm",2020-02-10,"ARW","https://www.theguardian.com/world/2020/mar/24/china-to-lift-travel-restrictions-in-hubei-after-months-of-coronavirus-lockdown","2020-04-15","TCO",NA
"Xiaogan City","Hubei Province","Xiaogan","China",NA,2020-01-23,2020-03-25,"yes",NA,NA,NA,"https://www.ettoday.net/news/20200210/1642382.htm",2020-04-15,"TCO","https://www.theguardian.com/world/2020/mar/24/china-to-lift-travel-restrictions-in-hubei-after-months-of-coronavirus-lockdown","2020-04-15","TCO",NA
"Huangshi City","Hubei Province","Huangshi","China",NA,2020-01-24,2020-03-25,"yes",NA,NA,NA,"https://www.ettoday.net/news/20200210/1642382.htm",2020-04-15,"TCO",NA,NA,NA,NA
"Nanjing City","Jiangsu Province","Nanjing","China",NA,2020-02-04,2020-02-24,"yes",NA,NA,"Since February 19, no new confirmed cases have been found in Jiangsu，province, China for 6 consecutive days. The People's Government of Jiangsu Province decided to adjust the emergency response level of epidemic prevention and control from so-called wartime control measures (the first-level response) to the second-level response since 24:00 on February 24.","https://www.ettoday.net/news/20200210/1642382.htm",2020-02-10,"ARW",NA,NA,NA,NA
"Nantong City","Jiangsu Province","Nantong","China",NA,2020-02-04,2020-02-24,"yes",NA,NA,"Since February 19, no new confirmed cases have been found in Jiangsu，province, China for 6 consecutive days. The People's Government of Jiangsu Province decided to adjust the emergency response level of epidemic prevention and control from so-called wartime control measures (the first-level response) to the second-level response since 24:00 on February 24.","https://www.ettoday.net/news/20200210/1642382.htm",2020-02-10,"ARW",NA,NA,NA,NA
"Xuzhou City","Jiangsu Province","Xuzhou","China",NA,2020-02-04,2020-02-24,"yes",NA,NA,"Since February 19, no new confirmed cases have been found in Jiangsu，province, China for 6 consecutive days. The People's Government of Jiangsu Province decided to adjust the emergency response level of epidemic prevention and control from so-called wartime control measures (the first-level response) to the second-level response since 24:00 on February 24.","https://www.ettoday.net/news/20200210/1642382.htm",2020-02-10,"ARW",NA,NA,NA,NA
"Jingdezhen CIty","Jiangxi Province","Jingdezhen","China",NA,2020-02-04,2020-03-21,"yes",NA,NA,"closed management","https://www.ettoday.net/news/20200210/1642382.htm",2020-02-10,"ARW","https://www.yicai.com/news/100558891.html","2020-05-07","TCO",NA
NA,"Jiangxi Province","Nanchang","China",NA,2020-02-05,2020-03-21,"yes",NA,NA,"closed management","https://www.ettoday.net/news/20200210/1642382.htm",2020-02-10,"ARW","https://www.yicai.com/news/100558891.html","2020-05-07","TCO",NA
NA,"Jilin Province","Changchun","China",NA,2020-01-28,2020-02-26,"yes",NA,NA,"intercity buses suspended","http://en.changchun.gov.cn/xw/ccxw1/202002/t20200205_2077406.html",2020-02-14,"ARW","http://en.nhc.gov.cn/2020-05/19/c_80281.htm","2020-05-21","TCO",NA
NA,"Jilin Province",NA,"China",NA,2020-01-26,NA,NA,NA,NA,"interprovincial buses suspended","http://en.changchun.gov.cn/xw/ccxw1/202002/t20200205_2077406.html",2020-02-14,"ARW",NA,NA,NA,NA
"Wuzhong City","Ningxia Hui Autonomous Region","Wuzhong","China",NA,2020-01-31,2020-02-28,"yes",NA,NA,"Ningxia downgraded its emergency response from the top level to the second level on Feb. 28.","https://www.ettoday.net/news/20200210/1642382.htm",2020-02-10,"ARW","http://en.nhc.gov.cn/2020-05/07/c_79922.htm","2020-05-22","TCO",NA
"Yinchuan City","Ningxia Hui Autonomous Region","Yinchuan","China",NA,2020-01-31,2020-02-28,"yes",NA,NA,"Ningxia downgraded its emergency response from the top level to the second level on Feb. 28.","https://www.ettoday.net/news/20200210/1642382.htm",2020-02-10,"ARW","http://en.nhc.gov.cn/2020-05/07/c_79922.htm","2020-05-22","TCO",NA
"Xian","Shaanxi Province","Xi'an","China",NA,2020-01-25,NA,NA,NA,NA,"interprovincial road passenger transport","http://companies.caixin.com/2020-01-26/101508589.html",2020-02-08,"ARW",NA,NA,NA,NA
NA,"Shandong Province","Jinan","China",NA,2020-02-05,2020-03-08,"yes",NA,NA,"closed management; Shandong lowered the emergency response from the top level to the second level","https://www.ettoday.net/news/20200210/1642382.htm",2020-02-10,"ARW","http://www.xinhuanet.com/english/2020-03/08/c_138853763.htm","2020-05-22","TCO",NA
"Qingdao","Shandong Province","Qingdao","China",NA,2020-02-05,2020-03-08,"yes",NA,NA,"closed management; Shandong lowered the emergency response from the top level to the second level","https://www.ettoday.net/news/20200210/1642382.htm",2020-02-10,"ARW","http://www.xinhuanet.com/english/2020-03/08/c_138853763.htm","2020-05-22","TCO",NA
NA,"Shandong Province","Rizhao","China",NA,2020-02-05,2020-03-08,"yes",NA,NA,"closed management; Shandong lowered the emergency response from the top level to the second level","https://www.ettoday.net/news/20200210/1642382.htm",2020-02-10,"ARW","http://www.xinhuanet.com/english/2020-03/08/c_138853763.htm","2020-05-22","TCO",NA
NA,"Shandong Province","Tai'an","China",NA,2020-02-05,2020-03-08,"yes",NA,NA,"closed management; Shandong lowered the emergency response from the top level to the second level","https://www.ettoday.net/news/20200210/1642382.htm",2020-02-10,"ARW","http://www.xinhuanet.com/english/2020-03/08/c_138853763.htm","2020-05-22","TCO",NA
NA,"Shandong Province",NA,"China",NA,2020-01-25,NA,NA,NA,NA,"interprovincial road passenger transport","http://companies.caixin.com/2020-01-26/101508589.html",2020-02-08,"ARW",NA,NA,NA,NA
NA,"Shanghai","Shanghai","China",NA,2020-01-25,2020-03-24,"yes",NA,NA,"interprovincial road passenger transport; Shanghai will lower its public health emergency response to the COVID-19 epidemic from the highest to the second-highest level on Mar 24, according to the Shanghai municipal government.","http://companies.caixin.com/2020-01-26/101508589.html",2020-02-08,"ARW","http://en.nhc.gov.cn/2020-03/23/c_78146.htm","2020-05-22","TCO",NA
NA,"Sichuan Province","Chengdu","China",NA,2020-02-08,2020-03-04,"yes",NA,NA,"As of 19:00, 4 March, eight provinces, namely, Shanxi, Guangdong, Jiangsu, Xinjiang, Sichuan, Ningxia, Zhejiang and Heilongjiang, lowered their emergency response to COVID-19 from level 1 to level 2","https://www.ettoday.net/news/20200210/1642382.htm",2020-02-10,"ARW","http://en.nhc.gov.cn/2020-03/05/c_77319.htm","2020-05-21","TCO",NA
NA,"Sichuan Province","Neijiang","China",NA,2020-02-06,2020-03-04,"yes",NA,NA,"closed management; As of 19:00, 4 March, eight provinces, namely, Shanxi, Guangdong, Jiangsu, Xinjiang, Sichuan, Ningxia, Zhejiang and Heilongjiang, lowered their emergency response to COVID-19 from level 1 to level 2","https://www.ettoday.net/news/20200210/1642382.htm",2020-02-10,"ARW","http://en.nhc.gov.cn/2020-03/05/c_77319.htm","2020-05-21","TCO",NA
NA,"Sichuan Province","Yibin","China",NA,2020-02-06,2020-03-04,"yes",NA,NA,"closed management; As of 19:00, 4 March, eight provinces, namely, Shanxi, Guangdong, Jiangsu, Xinjiang, Sichuan, Ningxia, Zhejiang and Heilongjiang, lowered their emergency response to COVID-19 from level 1 to level 2","https://www.ettoday.net/news/20200210/1642382.htm",2020-02-10,"ARW","http://en.nhc.gov.cn/2020-03/05/c_77319.htm","2020-05-21","TCO",NA
